{
  "schema_version": 2,
  "contract_version": "1.0.0",
  "run_id": "run-example",
  "message_id": "message-unknown-component",
  "sequence": 3,
  "source_version": 1,
  "state_sequence": 2,
  "role": "assistant",
  "created_at": "2026-10-02T02:00:00Z",
  "modes": {
    "execution_mode": "temporal",
    "decision_mode": "rules",
    "delivery_mode": "local"
  },
  "parts": [
    {
      "part_id": "part-unknown",
      "part_version": 1,
      "type": "component",
      "fallback_text": "只读组件摘要",
      "component_id": "cmp-part-unknown",
      "component_version": 1,
      "component_type": "network_chart",
      "component_schema": "urn:agentstudio:component:network_chart:1.0.0",
      "payload": {
        "nodes": [
          {
            "id": "a",
            "label": "只读节点"
          }
        ],
        "edges": []
      }
    }
  ]
}
